artist,album,track_name,track_id,danceability,energy,key,loudness,mode,speechiness,instrumentalness,liveness,valence,tempo,duration_ms,time_signature,owner,playlist_name,user
Ludovico Einaudi,In A Time Lapse (Deluxe Edition),Experience,4BTPwdNcGQK2GQxwvKkiZI,0.447,0.449,2,-10.634,1,0.0376,0.961,0.0697,0.036,92.468,315427,4,Spotify,hopeless romantic,Public J
Vitamin String Quartet,Bridgerton (Covers from the Netflix Original Series),Wildest Dreams,2fuiA0FQANMrcr2jXMc0nP,0.45,0.275,8,-11.48,1,0.0374,0.0711,0.0847,0.311,140.094,203293,4,Spotify,hopeless romantic,Public J
Vitamin String Quartet,"Geek Wedding, Vol. 2: The Sequel",Howl's Moving Castle - Merry-Go-Round of Life,20nMssNxX89e7YMoT0gpFQ,0.258,0.179,2,-13.822,0,0.0454,4.49e-05,0.0709,0.446,72.795,184875,3,Spotify,hopeless romantic,Public J
Max Richter,"Recomposed By Max Richter: Vivaldi, The Four Seasons",Spring 1 - 2012,4gmhjAsvL6c7se2PBh7dHw,0.701,0.341,1,-12.26,0,0.0418,0.903,0.359,0.163,105.513,151507,3,Spotify,hopeless romantic,Public J
James Newton Howard,A Hidden Life (Original Motion Picture Soundtrack),A Hidden Life,6VhExWbPovba3QfMY1sw7U,0.0975,0.0483,5,-27.155,0,0.0473,0.305,0.0928,0.0601,81.53,170653,4,Spotify,hopeless romantic,Public J
Ludwig van Beethoven,Beethoven Trilogy 2: Childhood,"Piano Sonata in C Major, WoO 51: II. Adagio",7EmiVtjY6KsnDgroaePON5,0.194,0.0269,5,-34.472,1,0.0413,0.963,0.0626,0.137,171.966,150907,4,Spotify,hopeless romantic,Public J
Alexander Joseph,Für Elise - Reimagined,Für Elise - Reimagined,6z720DAWxYJL5SacdZLlEN,0.202,0.161,10,-22.956,0,0.0484,0.891,0.134,0.187,166.287,360196,4,Spotify,hopeless romantic,Public J
Tristan Seewer,À Bout de Souffle,À Bout de Souffle,3IbO32QxBvn6bgyzjmqsJy,0.14,0.166,10,-18.0,0,0.0401,0.817,0.392,0.0369,74.41,144604,4,Spotify,hopeless romantic,Public J
Dario Marianelli,Pride and Prejudice - OST,"Dawn - From ""Pride & Prejudice"" Soundtrack",2k2MprlqkmDMKKOOWGREzW,0.332,0.0525,0,-24.1,1,0.0388,0.891,0.0683,0.097,78.853,158600,3,Spotify,hopeless romantic,Public J
Michael Forster,Piano Chill,Cornfield Chase - Piano-Cello Version,0dn7lN2ky5BnUJNoELXh3i,0.325,0.216,9,-17.214,0,0.0352,0.861,0.128,0.109,99.635,124453,3,Spotify,hopeless romantic,Public J
Original Soundtrack,Becoming Jane,First Impressions,09I7DjJtkvTPORULHE7yCY,0.163,0.021,5,-26.363,1,0.0478,0.884,0.0868,0.0367,129.627,145173,4,Spotify,hopeless romantic,Public J
Peter Gregson,Bach: The Cello Suites - Recomposed by Peter Gregson,6.6 Gigue,6yPUtBVbbSpp7khUpcmcDu,0.374,0.351,2,-10.522,1,0.044,0.71,0.103,0.0852,82.56,168676,4,Spotify,hopeless romantic,Public J
Various Artists,"Film Music - Williams, J. / Barry, J. / Bacharach, B. / Nyman, M. / Lloyd Webber, A. / Armstrong, C. (Film Harmonic) (Royal Philharmonic)",Romeo + Juliet (arr. P. Bateman): Romeo and Juliet: The Balcony Scene (arr. P. Bateman for piano and orchestra),5FOHBhUtWl2x5Z6qflA8nd,0.147,0.0457,0,-19.188,1,0.042,0.927,0.106,0.0364,138.942,349920,1,Spotify,hopeless romantic,Public J
Various Artists,Hollywood '96 (Themes From The Year's Biggest Films),"Theme - From ""Emma""",06mi7oiYv5pftvpFU784jc,0.155,0.0612,7,-21.803,1,0.0439,0.868,0.0978,0.0361,91.989,179493,3,Spotify,hopeless romantic,Public J
Gabriel Fauré,Fauré: Dolly Suite; Nocturnes; Barcarolles; Impromptus,"Dolly, Op. 56: 1. Berceuse",3NbAsIxDL0fVgNuCLD152P,0.37,0.0076,4,-33.663,1,0.0384,0.91,0.0864,0.278,62.668,176518,4,Spotify,hopeless romantic,Public J
William Howard,Sixteen Contemporary Love Songs for Piano,Roses in a Box,20BUmbjIRXr7MnGjNaC2R2,0.19,0.02,11,-33.983,0,0.0489,0.897,0.118,0.114,214.261,221401,4,Spotify,hopeless romantic,Public J
Christopher Willis,The Personal History of David Copperfield (Original Motion Picture Soundtrack),David's Writings,4Q0VPrw0jgRB7onKAtRnFG,0.299,0.357,1,-13.535,0,0.0325,0.91,0.143,0.0391,92.314,177773,4,Spotify,hopeless romantic,Public J
James Horner,Titanic: Original Motion Picture Soundtrack - Collector's Anniversary Edition,The Portrait,0yIM3MDx8UTwueyoZJobsb,0.297,0.0214,5,-32.398,1,0.0658,0.934,0.0652,0.132,212.349,283227,4,Spotify,hopeless romantic,Public J
John Debney,The Princess Diaries,The Princess Diaries Waltz - Score,60vDJQPOMYUkL388zPpuNT,0.253,0.151,9,-18.081,1,0.0345,0.909,0.121,0.151,136.754,129000,5,Spotify,hopeless romantic,Public J
Music Lab Collective,Adore You (arr. string quartet) [Inspired by ‘Bridgerton’],Adore You (arr. string quartet) - Inspired by ‘Bridgerton’,0ovIP1mWermyLY91w6SMnh,0.416,0.197,0,-10.952,0,0.0314,0.678,0.0892,0.479,99.929,198411,4,Spotify,hopeless romantic,Public J
Antonio Vivaldi,"Vivaldi Variation (Arr. for Piano from Concerto for Strings in G Minor, RV 156)","Vivaldi Variation (Arr. for Piano from Concerto for Strings in G Minor, RV 156)",3Dgmyz32dxvtxvUTPS0CUI,0.429,0.258,7,-16.967,0,0.0549,0.893,0.115,0.0972,78.809,112353,1,Spotify,hopeless romantic,Public J
Alessio Bax,Lullabies for Mila,"Sheep May Safely Graze, BWV 208 (arr. Egon Petri)",2md3xXPRJz9dIyFZi8MNyY,0.415,0.00977,10,-35.055,1,0.0409,0.965,0.11,0.142,91.468,318320,4,Spotify,hopeless romantic,Public J
Various Artists,Bridgerton Season Two (Covers from the Netflix Series),You Oughta Know,6eZXxcFFDaAcAli6LsEJdF,0.243,0.11,4,-20.122,1,0.0441,0.894,0.142,0.0386,83.265,167610,4,Spotify,hopeless romantic,Public J
Jean-Michel Blais,aubades,amour,47kA4ykK0Rlwjf8oV2HMo7,0.175,0.212,6,-14.073,1,0.0374,0.86,0.0979,0.128,132.026,277853,3,Spotify,hopeless romantic,Public J
Martin Phipps,The Aftermath (Original Motion Picture Soundtrack),"New Start - From BBC Series ""North & South""",50MGKn5CGI8es0itdbs851,0.0797,0.0543,7,-17.539,1,0.0393,0.825,0.0951,0.0361,81.466,221669,4,Spotify,hopeless romantic,Public J
Antonín Dvořák,"Dvořák: American String Quartet & Quintet, Op. 96-97","String Quartet No. 12 in F Major, Op. 96 'The American': III. Molto vivace",4zdQ0Tx3rbYaBmgG22fYUH,0.404,0.0545,5,-19.837,1,0.0532,0.486,0.102,0.294,70.468,248347,4,Spotify,hopeless romantic,Public J
Craig Armstrong,Far from the Madding Crowd (Original Motion Picture Soundtrack),Opening,0x1rnXl24iJl8xZFMkoyNv,0.138,0.189,2,-15.733,0,0.0394,0.279,0.113,0.0729,91.207,279547,4,Spotify,hopeless romantic,Public J
Patrick Doyle,Sense & Sensibility - Original Motion Picture Soundtrack,My Father's Favourite,0LrA0EtiJsr4tDHIGw82OW,0.109,0.0693,8,-21.196,1,0.0388,0.931,0.13,0.0411,58.869,327573,4,Spotify,hopeless romantic,Public J
Stephan Koncz,"GoldBergHain (Quodlibet on ""Kraut und Rüben haben mich vertrieben"") for Violin & String Orchestra","GoldBergHain (Quodlibet on ""Kraut und Rüben haben mich vertrieben"") for Violin & String Orchestra",5bmp5QR3Dwb5r9kgEX8kF3,0.394,0.133,7,-19.88,1,0.0513,0.102,0.166,0.414,116.711,164973,4,Spotify,hopeless romantic,Public J
Jorge Federico Osorio,The French Album,"Pavane, Op. 50 (Version for Piano)",2mNQl3DEWtkrwKllwYpxi0,0.392,0.0152,6,-30.684,0,0.0424,0.885,0.081,0.12,74.963,359464,4,Spotify,hopeless romantic,Public J
Music Lab Collective,drivers license (arr. string quartet) [Inspired by ‘Bridgerton’],drivers license (arr. string quartet) - Inspired by ‘Bridgerton’,4vy1RotKCE0qpxw3GZyLXS,0.18,0.221,10,-11.331,1,0.0468,0.709,0.105,0.227,81.641,242003,4,Spotify,hopeless romantic,Public J
Isobel Waller-Bridge,EMMA. (Original Motion Picture Soundtrack),Emma Suite,6nQImNsFZlgsn9KeMbkjJT,0.325,0.19,0,-14.988,1,0.0395,0.585,0.0932,0.14,118.507,367867,4,Spotify,hopeless romantic,Public J
Andrew Sparrow,Sparrow: Pluto's Crossing,Pluto's Crossing: Id. The Journey,2B7DzfgaMkfVVv9pT2q43P,0.293,0.275,3,-13.281,0,0.0326,0.958,0.145,0.157,106.786,124653,4,Spotify,hopeless romantic,Public J
Anne Dudley,Poldark: Music from the TV Series (Deluxe Version),Resurgam,4SsC4oX1tyBUFBSy4Gbw2l,0.0615,0.193,5,-14.944,0,0.038,0.925,0.101,0.0419,48.828,207107,3,Spotify,hopeless romantic,Public J
Daniel Pemberton,Enola Holmes (Music from the Netflix Film),Tewkesbury's Trail,7i6aVrjKTpxz0I2G3IubY9,0.287,0.0894,0,-20.391,1,0.036,0.971,0.159,0.0362,108.271,101253,4,Spotify,hopeless romantic,Public J
Johann Sebastian Bach,Bach: Unaccompanied Cello Suites (Remastered),"Cello Suite No. 1 in G Major, BWV 1007: I. Prélude",61dYvvfIRtIDFuqZypPAta,0.257,0.109,7,-21.356,1,0.0597,0.867,0.0762,0.307,75.02,151480,4,Spotify,hopeless romantic,Public J
Alexandre Desplat,Little Women (Original Motion Picture Soundtrack),Plumfield,4RTmPGLfkrUJgfFAJOzWil,0.449,0.267,10,-15.301,1,0.0288,0.934,0.119,0.104,88.003,218800,4,Spotify,hopeless romantic,Public J
Johann Christian Bach,"J.C. Bach: Sonata No. 5 in A Major, Op. 17, No. 5: I. Allegro","Sonata No. 5 in A Major, Op. 17, No. 5: I. Allegro",72CwEwj0LHNDMgH2zXCa1f,0.236,0.108,9,-27.586,1,0.0388,0.896,0.134,0.444,134.989,218787,4,Spotify,hopeless romantic,Public J
Jan A.P. Kaczmarek,Finding Neverland,Peter - Finding Neverland/Soundtrack Version,5yrUw3CtVT8BQuhsDdniW1,0.153,0.0569,0,-20.918,1,0.0355,0.941,0.0761,0.0371,100.151,140933,4,Spotify,hopeless romantic,Public J
Wolfgang Amadeus Mozart,"Mozart: Adagio in E Flat (Arr. Ólafsson from String Quintet No. 3 in G Minor, K. 516)","Adagio in E Flat (Arr. Ólafsson from String Quintet No. 3 in G Minor, K. 516)",1pcsXJHyzP8YXVOMH3Noox,0.366,0.00533,3,-34.215,1,0.045,0.934,0.154,0.188,76.436,484220,4,Spotify,hopeless romantic,Public J
Rachel Portman,ask the river,leaves and trees,4fm8QxhBYRmmxU3Kp1pi3p,0.43,0.0788,1,-21.539,0,0.0314,0.909,0.099,0.123,98.35,357960,4,Spotify,hopeless romantic,Public J
Johann Sebastian Bach,"Bach: Goldberg Variations, BWV 988","Bach, JS: Goldberg Variations, BWV 988: Aria",5YDqSImE2uQDn7K7Gw6uvN,0.287,0.00562,4,-38.358,0,0.0417,0.906,0.0615,0.219,77.57,306386,4,Spotify,hopeless romantic,Public J
Aaron Zigman,The Best Of Me (Original Motion Picture Score),I Waited For You,3gpLoUSz1JsLb97VXUTtB5,0.0977,0.0639,7,-26.691,1,0.0402,0.9,0.244,0.0395,88.025,90187,3,Spotify,hopeless romantic,Public J
Martin Phipps,War & Peace (Original Soundtrack by Martin Phipps),The Dance,3h3dJgoTzyn1N6HN8Lan5g,0.16,0.0922,1,-21.167,1,0.0494,0.921,0.1,0.0499,62.858,181706,4,Spotify,hopeless romantic,Public J
Vitamin String Quartet,"VSQ Performs the Hits of 2014, Vol. 2",Stay with Me,4lWYROZtRMgHmDpdUtTI22,0.16,0.231,0,-9.086,1,0.0381,0.0928,0.133,0.137,82.757,175240,4,Spotify,hopeless romantic,Public J
